Creator,Theme,Patrons,Earnings,Per patron,Days Running,Launch Date,About
Essential Craftsman , Videos on Craftsmanship (essentialcraftsman),"2,039",,,1255,Apr 2017,NaN
The Antifada , The Antifada (theantifada),"2,038",,,943,Mar 2018,NaN
Sorastro , miniature painting tutorials (Sorastros),"2,036",,,1941,Jun 2015,NaN
Louise De Masi , watercolour painting tutorial videos (louisedemasi),"2,032",,,494,May 2019,"Hi, I'm Louise De Masi. I'm a professional artist from Australia specialising in watercolour paintings. If you are new here please read the information underneath my photo below. Click on 'Show More'.

 

My one true passion in life is painting and I'm here on Patreon to share my love of painting with you.
I've been painting for over 20 years now. I sell my paintings all around the world by harnessing the power of social media. Before I started painting full time I was a school teacher so I have a background in education. Now I am combining my love of painting with my teaching experience. 

I have had the pleasure of teaching online watercolour classes to over 20,000 students worldwide. Daily questions about my painting techniques and the materials I use are asked through my email and social media platforms. At times it can be difficult to answer everybody. So, I recently started adding watercolour tutorials to my and the response has been fantastic. However, the amount of time required to produce good quality video tutorials is enormous, see my video here: 
So I hope, with your support, I'll be able to share even more.

For as little as $6 (US) a month you will have access to my entire library of 49 in-depth, full length, voiced-over video watercolour painting tutorials. Most of these tutorials will include the line drawing and reference photo so that you can paint along with me.
I will also share behind the scenes photos of my painting and creative processes. By becoming a patron you will have access to all of this and more.


You can leave at any time because there are no contracts."
Afternoon Maps , RPG and DnD battlemaps (afternoonmaps),"2,032","$3,246 per Map",$1.60 per Map,812,Jul 2018,"Hello and welcome adventurer!
I'm Neil, known here as AfternoonMaps. I love Pen and Paper RPGs and for the last few months I've been creating battle maps for fun and for the kind people that support me here on Patreon. I started off making maps for my home game and thought ""Hey maybe other people would like these"". It turned out that some people do like them and I've been creating a few maps a month for a while now.

My goal for each month is simple... create between 2-4 battle maps along with some fun ideas on how to use them in your game. The amount of maps launched in a month largely depending on my free time and the complexity of the maps. I work as a freelancer, which basically means some weeks I'll have lots of time to create maps and other weeks I'll be unable to create maps due to work commitments. I take feedback and suggestions from my Patrons on what they want to see next, where I can improve and what they find most useful. You can take a look at my public launch posts to see what maps I've released over the last few months and I'll often post public updates for my Patrons and Followers to keep them up to date on what I'm working on next. Even if you don't end up becoming a Patron, you can still follow me here to get my updates!

Becoming a Patron has a few benefits, they are all listed on the right hand side of the page. If you have any questions you can message me here, I'll respond as soon as I can.

As for me personally, I'm a geek that loves tabletop games, fantasy fiction and being creative. Over the last year or two I've managed to find a bunch of great people to start playing DnD with, something that's been sadly lacking from my life for many years. Now I even run my own campaigns when I have time.

Here is an example of my most recent maps!


















I hope my scribbles are useful to a few of my fellow geeks. It gives me a warm fuzzy feeling inside to think that maybe, in some small way, I can help a storyteller bring their world to life just a little bit more. That's just so awesome!

And now the boring bit!

: As a Patron, all maps and assets posted on this Patreon are licenced for your personal use under a Attribution-NonCommercial-ShareAlike 4.0 International licence. Basically, my maps and assets are licenced to you for use in your RPG campaigns, to share with friends and to edit as you see fit.

You can read more about the licence here:



Currently I'm not licencing my maps out commercially or taking commission."
MajorKill , Warhammer Fantasy + 40K Lore Videos for YouTube (majorkill),"2,031","$5,344 per month",$2.63 per month,871,May 2018,NaN
HASfit , a motivational fitness tribe (hasfit),"2,029",,,1471,Sep 2016,"We'll use your donation to make HASfit better for everyone:


Some of our major monthly costs include production equipment, set overhead, software, lights, video storage, and website hosting.

We do most of the technical work ourselves ( ), but would of your favorite .



You’ll get access to the , where everyone centralizes and everything gets posted and talked about.


















Yes, please. 55% of HASfit’s audience is from outside of the U.S., so we need your help too. 


No, pledge in any currency! Everything is written in Dollars, but it will be automatically converted when you pledge.


Yes, every dollar makes a huge difference! Your one-dollar may be just what we needed to launch a new program or replace broken equipment.


Yes of course! We only want you to give when you feel led to do so. If you can't afford to donate in the future, or you need to donate less just log in to change or cancel the account at anytime.


No, you dot have to redeem the rewards. If you'd just like to give, then click on the button that says ""Get $ Reward"" and you can adjust your donation amount on the next page.


If you have other questions about the rewards or how Patreon works that you don't see listed here, then feel free to email us at"
Ksuihuh's Corner , Mods for The Sims 4 (ksuihuh),"2,028",,,795,Aug 2018,NaN
AdFreeShows.com , all your favorites...without the sales pitch (adfreeshows),"2,023",,,257,Jan 2020,NaN
The Ukulele Teacher , fun lessons and covers for players of all abilities! (uketeacher),"2,017",,,2086,Jan 2015,NaN
Gina Häußge , OctoPrint (foosel),"2,014","$6,161 per month",$3.06 per month,1637,Apr 2016,NaN
KiaraSims4Mods , Mods For The Sims 4 (kiarasims4mods),"2,008",,,614,Jan 2019,NaN
Art with Flo , Digital Art tutorials for Procreate (artwithflo),"2,005",,,725,Oct 2018,"You want to improve your digital art skills? You've come to the right place! Join me on a digital art journey. You can start with my beginner level tutorials and ask me anything you want to know or dive in deeper by watching my video tutorials about specific subjects. Whatever you decide I'm always here to help.
>>  LIST OF ALL (VIDEO) TUTORIALS <<
As a Patron, you pay a monthly fee. It is charged as soon as you join and after that, you will be charged at the beginning of every month.

I'm Flo and I would love to make digital art with you!
What can you expect when becoming a Patron?
Tutorial Videos: I share at least 3 fully narrated video tutorials a month, these range from beginner tutorials to more advanced tutorials. 
No Secrets! I will show you my entire process and every brush I use, I don't have any secrets for you and you may ask me anything.
Once you join and become one of my Patrons, you have . Be sure to check out the rewards for each tier though. For instance, Eager Learners will have access to the content of the previous two months (plus the current month) and I have previously shared."
Issa Rae Presents ," Series, Films, Events (issarae)","2,000",,,2414,Feb 2014,NaN
FIFER , The FIFA 20 Realism Mod (realismmod),"1,995",,,478,Jun 2019,NaN
LS ," League of Legends Content, Full-time streaming (lsxyz9)","1,993","$11,048 per month",$5.54 per month,814,Jul 2018,NaN
Utsava Psychic Medium Democracy Lesson # 1 , Prophecies and Psychic Predictions (utsava),"1,991",,,955,Feb 2018,NaN
That Chapter , cheerfully creepy YouTube videos (thatchapter),"1,981","$4,152 per month",$2.10 per month,776,Aug 2018,NaN
John Pollock & Wai Ting , POST Wrestling podcasts (POSTwrestling),"1,980",,,1017,Dec 2017,NaN
The First Defier , Defiance of the Fall (DefianceNovels),"1,977",,,481,Jun 2019,NaN
AYA(´・ω・｀) , FUTANARI DRAWING (aya_shobon),"1,974",,,1408,Nov 2016,NaN
Garand Thumb , Super Lit Youtube videos (GarandTHumb),"1,973",,,1086,Oct 2017,NaN
Cambrian , Fictional Stories (Cambrian),"1,973","$3,956 per month",$2.00 per month,1322,Feb 2017,"[Update 2/14/19]

As of the date posted above, this Patreon has NEW Exclusive Content in the form of Story Polls! These are not to be confused with my Weekly Prompt Poll, which will remain unchanged for the foreseeable future. However, one thing that has changed regarding the Weekly Prompt Poll is tagging.

From February of 2019 on, all Weekly Prompt Polls will now be tagged with ""Prompt Poll"" rather than just ""Poll"" while all Weekly Poll Results will be tagged with both ""Prompt Poll"" and ""Poll Results"" for ease of finding.

Meanwhile, Story Polls are both exclusive story content as well as polls that allow you to decide the future direction of said story. Each story (of which I plan for there to eventually be four in total) will always have the two newest chapters as exclusive story content, here on my Patreon. 

[Update 4/10/18]

As of the date posted above, this Patreon DOES in fact have exclusive content! Pledging as little as $1 to my Patreon not only gets you access to voting in the Weekly Prompt Poll, it also gets you access to all Prompt Poll Winners, which are Patreon-Only from April on!

To find these exclusive Patreon Pieces, look for ""Poll Winner"" or ""Bonus Exclusive"" under the Featured Tags on the left side of my Patreon. As of the time of this writing, that's only one piece... but as the weeks and months go on, the number of exclusive pieces on my Patreon will continue to grow!

Join in on the fun today!



As of today (the date above this), this Patreon is no longer on a month delayed release schedule. , as I have had to remove all noncon and dubcon material from the Patreon Page in order to conform to Patreon's Community Guidelines.

Everything I write is posted to either Questionable Questing or Hentai-Foundry, or both. Links can be found below.

If you choose to pledge to my Patreon Page, you do so simply because you want to support me... or because you want to participate in my Patreon-Only Weekly Prompt Polls in some fashion! Either way, thank you for your time and your consideration in checking out my Patreon.



Hey there, I'm Cambrian and I really love writing fiction, especially erotic fiction. I hope to turn this into a source of income for me so I can do more of it.

Without this Patreon, my ability to write for all of you will diminish over time as I have to ""Grow up"" and ""Get a real life"". If you like what I do, like what you see from me, and want to see more of it, please consider contributing to my Patreon! You'll be helping me build my dream of making a career out of being a writer!

If you support me as a reader or a patron, thank you.







Please follow me at: !"
Homestuck , Homestuck^2: Beyond Canon (homestuck),"1,972",,,347,Oct 2019,"Paradox space has fallen, consumed by a black hole large enough to contain a multiverse. No longer must our heroes toil in the service of the ""alpha timeline."" The Prince and his Seers seek to preserve the Canon-That-Was at great personal and narrative cost. But inside the black hole, those who the paradox once discarded seek to claw back to relevance and escape to the Fanontinuum, a new fabric of story and space woven by the hands of new narrators, thousands of voices that fill the vacuum left by the death of the author.

This is not Homestuck. But it is not not Homestuck. This is...

HOMESTUCK^2: BEYOND CANON

Homestuck^2: Beyond Canon is an official continuation of the cult-classic webcomic Homestuck and a follow-up to The Homestuck Epilogues, dropped as a major event in April of this year. Homestuck 2: Beyond Canon takes a combination of Andrew Hussie's original writing and plot outlines and concepts and joins him with a team of new, diverse voices to expand the compelling narratives of Homestuck's most (and least) beloved characters.

This story was originally created by Andrew Hussie and will be told by him and a new team. This Patreon supports What Pumpkin and all authors and artists on this project. Additional funding beyond what's required to create the project will support new projects from What Pumpkin, and a portion of the proceeds will be directly shared with the creative contributors to this comic. "
Arc , Adult Visual Novels and Games! (arcgames),"1,972","$4,860 per month",$2.46 per month,479,Jun 2019,NaN
Captain Awkward , Advice blogs (CapAwkward),"1,967",,,1505,Aug 2016,NaN
Benjamin Dixon , the dopest progressive podcast in the game. (thebpdshow),"1,966",,,2024,Mar 2015,NaN
Joe Scott , new perspectives on the world and the universe on YouTube! (answerswithjoe),"1,961",,,1625,Apr 2016,NaN
Celadon Software , Mobile apps (celadonapps),"1,961",,,356,Oct 2019,NaN
Cutesexyrobutts , NSFW drawings (cutesexyrobutts),"1,960","$10,227 per month",$5.22 per month,688,Nov 2018,"Hey there, Cutesexyrobutts here. I mostly draw big and strong women, of the suggestive or NSFW kind. I'm probably mainly known for the big psychopath glowing eyes girl and the frog with the big ass. As you can see, those are very important subjects for humanity to move forward, so your support would be very important !

I grew up with videogames, anime and traditional fantasy, which is also my main inspiration for drawings many years later. What little I know I learned starting from age 27, completely incidentally, following youtube tutorials, all classical painting-oriented, so you'll find aspects of that here. I just realized I really liked the creation process so I stuck with it, and that's what I do for a living now. Basically, imagine if Leonardo da Vinci watched cartoons instead of learning anything.

You can see my stuff at [Tumblr], [Twitter], [Deviantart], [Hentai-Foundry] -!NSFW WARNING!
I've been planning to use patreon for a long time for the possible additional income, since I don't make a lot. Please spend responsibly. Anyways, thank you very much for liking the drawings and for your help should you choose to!

Live Updated commission status: CLOSED"
WAN HOI SECRET , article (wanhoisecret),"1,958",,,763,Sep 2018,"不是人,也不是神

【格羅兹尼重溫】

格羅兹尼第四十三公里「祖孽解碼」
Part A：https://www.patreon.com/posts/21361303
Part B：https://www.patreon.com/posts/21361777
Part C：https://www.patreon.com/posts/21361791
Part D：https://www.patreon.com/posts/21361802
Part E：https://www.patreon.com/posts/21361819

格羅兹尼第四十四公里:「北極之旅」
Part A：https://www.patreon.com/posts/21572986
Part B：https://www.patreon.com/posts/21572999
Part C：https://www.patreon.com/posts/21573017
Part D：https://www.patreon.com/posts/21573032
Part E：https://www.patreon.com/posts/21573046

格羅兹尼第四十五公里:「北極之旅續集」
Part A：https://www.patreon.com/posts/22038822














香港出生, 雲海, 真名陳雲海, 自小患得患上嚴重哮喘, 需長期服藥, 後來因服食中藥哮喘得以控制，1996年 一次在砂勞越被一群黑蜂針過後, 哮喘斷尾
就讀聖若瑟小學
外婆去世, 初感受到死之經驗
就讀聖若瑟中學
在何文田新法中學讀中六
在灣仔船街St.Gloria讀中七
在樹仁學院社會系社工系受教育(但未在樹仁學院畢業)
因不被選中讀社工系而退學
任社會褔利員
全職寫作及照顧患癌母親
母親去世, 開始退出已信十幾年的基督教
在新晚報得到第一個專欄講述美國有趣故事
跟會長Moon 到北京出席中港台UFO研究會，導演馬偉豪將Moon 方及雲海拍成電影""戇星先生""
雲海, Moon 方及MIB勇闖Area51 UFO聖地及羅茲威爾
因UFO會內事務及人事問題 退副會長及退出UFO Club
在Area 51 及羅茲威爾拍攝的獨立短片""UFO"", 得到獨立短片""佳作""名譽 藝術中心播放
任香港電台節目 ""華夫怕怕檔案"" 嘉賓主持
任香港電台節目 ""冇大冇細\"" 嘉賓主持
任新城電台節目 ""恐怖熱線""嘉賓支主持
任I02 i-channel 節目 ""靈點速遞""主持
任有線電視節目 ""怪談""主持
出版第一本書 ""02咖啡\""
出版第二本書 ""不死劫\""
任商業電台節目 ""靈幻搜奇""主持
已出版書藉有
""沿途魅驚""
""９１１世紀恐慌之末日解構""
出版書藉:
""旅遊魅驚""
""凶宅魅驚""
""香港異譚""之＜九龍驚室＞
""香港異譚""之＜新界冥域＞
""香港異譚""之＜港島魘地＞
""靈異竊聽\""之＜魅來報告＞
""ｘ檔案之旅１﹕錯體聖經之謎
－尋找迷失的挪亞方舟""
１１月出\""靈異竊聽\""之＜ＵＦＯ報告＞
仍然在各報章雜誌撰寫旅遊文章，
已到過70個國家及中國20個省及自治區 」"
aclee_ , meme streams (aclee_),"1,950",,,1079,Oct 2017,NaN
HydraFXX , 3D animations and images (HydraFXX),"1,949",,,640,Jan 2019,NaN
Historia Civilis , History Videos (HistoriaCivilis),"1,949",,,1985,May 2015,NaN
OSW Review , good times with wrestling! (OSWreview),"1,946","$11,110 per month",$5.71 per month,1559,Jun 2016,"HELLLLOOOO!
It's your boy, Jay Hunter! I've got one pitch, I wanna bring out more OSW more often!
That's it! Making OSW is my favourite thing in the world, and it kills me to tell you guys when episodes are delayed, and that in general OSW has become less frequent - and this is how I can make time! Creating episodes are a massive 1-man operation (aside from the recording session, everything OSW is done by me), and I love doing it. OSW is like another full-time job on top of my job, and with your help I'll be able to make more episodes more often, and pass the slavings onto you!



So we've set up NOGGER UNIVERSITY, which is our Patreon! Pledges will go straight back into making the show. It'll mean I can spend more time editing OSW and less time on not-OSW, as well as buying drinks for the lads/feeding OOC's Fabergé egg addiction.





• Our eternal gratitude!
• Being personally responsible for getting new OSW episodes out quicker!
•  Enroll/Sign up at any tier, I'll send you something in the mail, because you're a fucking legend!
• At $5+ you'll get access to There'll also be cool stuff like deleted scenes from past episodes.
• At $10+ I'll send you a What Bar Chocolate Bar in the mail (anywhere in the world!). It costs about a tenner to make and send so know that I love you!
• There's also offers including me reviewing , and sending you cool merch in the mail, have a look at the rewards to see if anything tickles your fancy (ooh-err!)

In any case, every OSW episode will remain FOC! free of charge, and every dorrah will help get out the next episode a little quicker.  Thanks for reading, and remember..."
VG Erotica , Erotic Animations (vgerotica),"1,941",,,1157,Aug 2017,NaN
Creambee , erotic interactive animations and games (creambee),"1,941","$4,785 per month",$2.47 per month,1340,Feb 2017,NaN
Loopop ," music tech ideas, tips, tricks and reviews (loopop)","1,940",,,784,Aug 2018,NaN
Bad Wolves , videos and music (badwolves),"1,935",,,189,Mar 2020,"Hey everyone,

This is Tommy, John, Doc, Chris and Kyle, and welcome to our Patreon!

We started this page as a way to stay connected to the WOLFPACK while everyone is stuck at home, social distancing.

We want to offer you guys exclusive content like interactive live rehearsals, tour diary videos, personal vlogs, as well as livestreamed acoustic performances only available to the die hard Wolf Pack members.

We’re also gonna do updates and check ins, so you guys can ask us questions directly in real time about music, sneakers, mental health, how to be in a band or really anything you want!

With all the shelter in place protocol interrupting the spring tour season we thought that this was the best way to stay connected to you guys and share music and hope as we all get through this rough patch together

So come join us as we show you how we’re getting through this quarantine, by jamming with us, working out with us, learning some cool guitar riffs so you can play our songs at home, or even just to fool us around with us, to ease some of the worry and boredom we’re all going through.

So remember boys and girls if you wanna take a trip, why not just sit at hope and RIP!

Bad Wolves"
Tom Siddell , Comics (gunnerkrigg),"1,933",,,2315,Jun 2014,NaN
episode 1 , podcasts (e1podcast),"1,931","$8,775 per month",$4.54 per month,1145,Aug 2017,NaN
Real Time History , The Great War Documentary Series (thegreatwar),"1,930",,,2049,Feb 2015,NaN
RAB Thoughts , Yankees analysis (RABthoughts),"1,929",,,528,Apr 2019,NaN
Shaun King and The Breakdown , a daily LIVE video news broadcast and a vibrant online community (thebreakdown),"1,928",,,171,Apr 2020,NaN
What Should I Read Next , bookish podcasts (whatshouldireadnext),"1,923",,,586,Feb 2019,"What Should I Read Next has been connecting readers with their next book every Tuesday since January 2016. Get closer to the literary matchmaking magic by supporting the show on Patreon!



What Should I Read Next isn’t just about book recommendations. It’s also a show that gets to the heart of how reading changes the lives of book lovers. One of my fundamental beliefs is that when you get more out of your reading life, you get more out of the rest of your life as well. My conversations with guests over the years have proved this nearly two-hundred-fold. Our guests have shared touching stories about how their favorite (and not-so-favorite) reads have provided inspiration and readerly satisfaction, forged new friendships, pulled together their family, provided emotional healing, broadened their horizons, reconnected them to their heritage, inspired a career change, or simply brought much-needed laughter into their life at just the right moment.

As a loyal listener, you know you’re already supporting the show just by tuning in every week! We appreciate this so much. And thoughtful emails and comments from listeners have bettered the WSIRN conversation since the beginning. , I’m most excited for the quarterly livestreams, when I’ll get to chat and play matchmaker with far more listeners than we’ll ever be able to book on the show!



WSIRN patrons immediately gain access to bonus episodes  never-released for you to use and share with friends, and here’s the big one–the  documenting favorites, hates, recommendations, and themes from every single episode, to make finding the perfect episode for your needs totally easy. You’ll also get instant access to the where WSIRN’s producer Brenna and your fellow patrons can hang out to chat about life, reading, and the latest episode.



PLUS we're doing , where you can ask questions, chat about what you’re reading, and participate in some lightning round live matchmaking! You’ll also have a direct hand in the WSIRN creation process through , and an early chance to submit audio clips for

If you'd like to come along and get closer to the creative process, click “become a patron” now to join WSIRN’s behind-the-scenes family.

Ah, how good it is to be among people who are reading! Thanks for reading—and listening!—with me.

~ Anne Bogel & the WSIRN team"
The Tribe (LOK TEAM) , LOK RE (LOK REBIRTH) (kuja),"1,923",,,1303,Mar 2017,NaN
Enjelicious , nsfw webtoon (ailejne),"1,922",,,1855,Sep 2015,NaN
Mat & Savanna , music and videos (matandsavanna),"1,921",,,60,Aug 2020,NaN
NumericGazer , Under The Witch__FemdomGame for Adults (UnderTheWitch),"1,915","$3,102 per month",$1.62 per month,919,Apr 2018,NaN
