Creator,Theme,Patrons,Earnings,Per patron,Days Running,Launch Date,About
Meesh , Erotic furry comics (Meesh),"3,185",,,1472,Sep 2016,"My name is Meesh, and I used to draw a lot of furry porn comics. I love making them, but I had to stop for a while to finish my last year of art school. After that, it just wasn't financially feasible to continue making comics with my own characters, stories and universes. This Patreon exists for that purpose--  to make quality furry porn comics again! If you'd like to see new comics with characters old and new, this is where you can help make it happen.

If you don't know what Patreon is, here's the gist of it: You choose a tier that fits your budget. The maximum tier gets you all the content on offer, while the lowest tier gets you a portion of it. Whichever tier you choose, it helps keep the lights on and the furry smut comin'.

Most if not all of my content will be of a pornographic nature, made for adults age 18 and up. I'm aiming to make a minimum of three comic pages a month, with themes ranging from gay, straight, bi, and some weird stuff inbetween. Comics will be uploaded here first for patrons to enjoy, and then made available to purchase for non-patrons once they have concluded. This page is also where you'll be able to view sketches and finished illustrations before anywhere else. Illustrations will be uploaded here as I finish them, and to my other galleries a month after completion. 

I've also provided links to my completed comics below.





Thank you for reading and I hope you'll decide to support me!

You can pick up prints of my Patreon illustrations right here: gumroad.com/meeshprints"
American McGee , Games (americanmcgee),"3,183",,,1564,Jun 2016,"Welcome to The Asylum
 
Your one-stop destination for ALL things Alice: Asylum and other projects too such as Pirate Jam, the Mysterious Shop, and an as yet unnamed Shoot-Em-Up.

We hope you will join us and The Insane Children in The Asylum and get your voice heard in the creation of the world's first ever crowd-designed triple-A game.



Who is American McGee? I've been developing games since 1994 and have a long list of  which include classics such as ""DOOM"" and ""American McGee's Alice."" Since 2000 I've worked as an independent developer and founded several development companies, most notably Spicy Horse in Shanghai which I ran until 2016. 

These days my work is contained within a company called . I've gone back to basics with a twisted fairy tale project called """" which presents ten classic tales as a tabletop card game, illustrated book, and collection of art prints. 



Mysterious is also where I'm starting work to present a new chapter in the Alice series with ""."" My goal is to build a production/design plan, have that plan approved by EA, and then raise funding to develop a new game.

I'm aiming at an as-yet unspecified date for the launch of the crowdfunding campaign (or announcement of a publishing/finance deal) and will spend the time leading up to this date preparing art, writing story/design, and sharing all of this with the Alice community. This is where come in...



Join me and the Alice community in shaping the visuals, mechanics, and narrative of Alice's next adventure. Via Patreon, , the , and other sharing platforms we're working as a team to make sure the next Alice game is everything you want it to be.

Here on Patreon you'll get early access to our creative output and have a direct line of communication to me and the community!

How do I use the funding? The production of art and design materials related to new projects like ""Alice: Asylum"" requires a time/money investment. Each new concept image can cost between $750 and $1200 depending on the style, complexity of the image, and artist in question.





Development updates to the various projects being created at Mysterious are posted to Facebook, , and other social media channels. 

As a Patron you will get:

---
Legal Notice Electronic Arts require us to display regarding Alice: Asylum and our efforts towards this project: "
Big Clive , Technical teardowns and creations. (bigclive),"3,182",,,1815,Oct 2015,"If you enjoy my technical videos, then this is an opportunity to show your appreciation by buying me coffee and cookies (I like cookies)  One of the most important things about Patreon is that it gives me an independent communication channel from YouTube so that if things go wrong or I'm VERY naughty and YouTube pull the plug on my channel then we can still stay in touch and you still get to see my videos on a different platform.
Since the great Adpocalypse of 2017 the YouTube advertising algorithm has not favoured ""dangerous"" technical and scientific channels and has given priority to trendy vloggers and fashionistas.  For the technical and scientific creators Patreon offers greater independence from YouTube, allowing us to make more interesting videos without fear of being punished.

My videos will always be available to view free.  I've no intention of ever putting them behind any form of pay-wall and specifically only allow YouTube to put adverts at the start of my videos, because mid-video adverts are just plain annoying.

All Patreons get early access to my videos as I make them, and sometimes encourage me to re-record specific videos with improvements.  This also lets you grab particularly good gadgets on eBay before the rush if I find a particular gadget to be very good.

Please only contribute what you can comfortably afford, and feel free to adjust it down at any time if things get a bit tight.  I've been through the ""living off noodles"" era myself and know that every technical career has its ups and downs.  No matter what you pledge you still get full access.
If you want to be extremely generous because I've helped launch you into a new career or inspired you in darker times then I'm fine with just a few dollars and would rather you used the cash to buy yourself some new test gear or components.  The biggest reward you can give me is to tell me that I helped you."
Trashfuture , a tech pessimist podcast (trashfuture),"3,181","$14,746 per month",$4.64 per month,763,Sep 2018,NaN
Wwindystar , TS4 MOD Translation (wwindystarZIMS),"3,161",,,1133,Aug 2017,NaN
MrDots Games , Visual Novel Games (mrdotsgames),"3,145",,,1557,Jul 2016,"Sunshine Love v0.0.3 RELEASE DATE:
August 29th, 2020

Sunshine Love v0.0.2 is finally here!

Base game: https://www.patreon.com/posts/38173983
Gallery Access Code: https://www.patreon.com/posts/38174982
Walkthrough: https://www.patreon.com/posts/38175106
Base game + Animations: https://www.patreon.com/posts/38175952
Save Files (v0.02 compatible): https://www.patreon.com/posts/38340536


Hi guys! Welcome to our Patreon page!

We're a team dedicated to creating Visual Novels. We like to create stories that focus on romance, slow build, and character development.

We're currently working on a project called , a first/third-person, choice-based visual novel.





















































You play a session musician who has had a busy lifestyle, having worked in various cities and towns across the country. This has been your life, ever since you graduated from college, where you attained a degree in the field of Music.

Once returning home, you decide to leave the place you grew up in, to start a new life and a fresh start in another town. You have also decided to take a break from the job you know so well, to focus on a brand-new career. You’re just not sure what that will be yet.

In order to keep the money coming in, you decide to take up a job offer, tutoring Melody, the niece of a woman you meet by chance via an online marketplace. Melody is currently studying music in college, so having an experienced tutor is pretty important for her chosen career path.

You will be spending time with Melody every day. Aside from one-on-one lessons, you will have with her, you will also be accompanying her at various music-related activities. If all goes well, you may even be able to go out on a date with her. And if that goes well too, it could lead to something even better!

You will be making decisions between two or more options, that will negatively or positively affect the outcome of the date and the main story as well. There will be a number of secondary characters and you'll be able to start a romantic relationship with them too.

Will you be that guy that wins Melody's heart and has her singing to her own tune again? Is it possible that you and Melody can make beautiful music together one day?

















That money goes directly into upgrading my equipment and making sure that we have enough time to keep developing these projects on a full-time basis.

But the cool thing for you is that you can get…

Patreon has this cool reward tier system where you get certain rewards depending on the amount of money you donate per month.

So for example:

• If you donate $5 per month, You'll also get access to of future releases.
• If you donate $10 per month, you’ll get access to all the rewards from the $5 tier, but you’ll also get


So that’s essentially the overview of Patreon and what it does for you! (and for us)



Thank you so much!"
UberPie , TaffyTales (UberPie),"3,136",,,726,Oct 2018,
2-Minute Tabletop , Maps & Assets for D&D and similar TTRPGs (2minutetabletop),"3,131",,,1818,Oct 2015,NaN
TeacupAudio , Audio Roleplays (TeacupAudio),"3,128",,,1578,Jun 2016,"Hey there! I'm TeacupAudio!

I'm a voice actress who specializes in audio role-plays. 

Think of these audios as a guided escape from reality - when you plug in your headphones you immediately become the central character of the story. These stories vary from light and fluffy to heavy and emotional, and somewhere in between some sensual audios too. 

A little bit about my work and the potential for ASMR:

ASMR stands for Autonomous Sensory Meridian Response! Listening to ASMR content can lead to a euphoric experience, such as a tingling sensation on the skin that usually begins on the scalp and moves down the back of the neck and upper spine. Ultimately, these audios are all about getting the listener to have fun, immerse themselves in the content and unwind from the day.

So, why become a Teacup? Pledges enable me to produce more content, explore new ideas, and invest in better equipment. As such, I can achieve a higher quality of audio and better both the roleplaying and ASMR experience.

I'd really love it if you considered joining our little, loveable community!

Thank you so much. 

All the best,
Teacup x

Profile art by imakureitto:"
Professor Cal , auditory experiences and other cool things (professorcalofficial),"3,120",,,47,Aug 2020,NaN
Kirsty Partridge , Real-Time Drawing & Painting Tutorials (kirstypartridge),"3,101","$19,103 per month",$6.16 per month,1197,Jun 2017,"Get instant access to a library of over 300 real-time drawing/ painting tutorials, when you become a patron! Every tutorial is narrated and I provide the reference, sketch outline and materials list for every tutorial so that you have everything you need to follow along with me. I offer tutorials for coloured pencil, watercolour, charcoal, graphite, pastels and more. Check out all of the tutorials I have on my Patreon here.

How do I easily find the tutorials that I want to see?

Use www.tutorials.kirstypartridge.com to easily navigate to the tutorials you want to follow along with. Also, if you are considering becoming a patron you can use this website to check out the library of tutorials I have on Patreon and find the ones that interest you!

Only interested in one medium/ subject matter?

If you're looking to learn one medium or if a monthly membership isn't right for you then I recommend checking out my Patreon tutorial bundles here. Each tutorial bundle includes everything you need to master each specific medium/ subject matter. The tutorial bundles are a one-off payment and you will have access to view these tutorials whenever you want!








Don't worry! It is really easy to cancel your pledge at any time via your Patreon account settings. Go to 'my memberships' and click edit next to my pledge. You will then see the option to cancel your membership.

Thank you so much for considering becoming a patron, I really appreciate the support!"
HEROES INFINITE by Raging Heroes , extraordinary 3D printable miniatures to play/paint/collect (HeroesInfinite),"3,101",,,187,Apr 2020,NaN
The Extra Credits Channel , Education That's Fun To Watch (ExtraCredits),"3,101",,,2361,Apr 2014,NaN
Asmr Mads , ASMR (asmrmads),"3,098",,,781,Aug 2018,"Hi loves! 
I am Maddie, an ASMRTIST who wants to give back to others who struggle to relax (like we all do at some point in time). I have been struggling with many health issues for over 6 years which is what lead me to ASMR. I was in bed one day unable to relax due to all of my pain, when I landed on an ASMR video that brought me some sort of relief/relaxation that I had been struggling to find. That day I decided to start my own channel on Youtube. In the hopes of giving someone else a minute to forget about their anxiety, to ease pain, give someone a friend that they don't have, etc. Being a creator has given me a feeling of purpose that I had been searching to find for so long. It has been the best experience!
Youtube has given me a support system I never had, socialization I haven't been able to have, and a safe space/family when needed. All of which I am forever grateful for! 

I decided to create this Patreon for a tighter community, and to offer another safe space to those who need it. I want this platform to be a chance to further open up about my life, let you all in a little more than I do on Youtube.  Not that I don't love my Youtube family, but it's such a big platform that anyone and everyone can see. This is a safer space where I hope only supporters come, and I feel more safe to open up. 

I hope my content can help you with whatever it is you are needing it to in this moment.
Your support means the world to me ALWAYS! Remember this is YOUR safe space, and you are always loved/welcomed here. 

 XOXO,
 Maddie"
Joe and Mark , Tuesdays With Stories (tuesdays),"3,096",,,1541,Jul 2016,NaN
Mona Relief Yemen , Humanitarian Aid in Yemen (monarelief),"3,090","$44,666 per month",$14.45 per month,443,Jul 2019,NaN
Mr. X-Toon , NSFW Gay Animations (mrxtoon),"3,082",,,154,May 2020,NaN
Blocked and Reported , podcasts (blockedandreported),"3,070","$17,732 per month",$5.78 per month,145,May 2020,"Blocked and Reported is a podcast by Katie Herzog (formerly of The Stranger) and Jesse Singal (a contributing writer and former staffer at New York Magazine) about weird internet nonsense and everything that entails. Part politics, part pop-culture, part obsessive dissection of esoteric internet slapfights, and sporadically insightful, Blocked and Reported is universally acknowledged as the first-ever podcast to discuss the internet.

The weekly podcast is free, so definitely check it out (or on Apple or Spotify or Stitcher). If your interest is piqued and you want to support the podcast, hear exclusive patrons-only content, and participate in online hangouts with the hosts, you've come to the right place.

Some of our five-star Apple Podcasts reviews:

If you’re looking for a funny, thoughtful, opinionated podcast about news that doesn’t matter much, this is a solid choice. I never cared about any of their controversies before listening and I still don’t after, which is frankly relieving with all the cataclysm I get daily from the NYT, the WSJ, etc. Katie and Jesse, keep it up, ya punks. (5/4/2020)





That's it! That's the pitch! Hope you enjoy.

( designed our awesome logos and graphics.)"
LGR ," Videos about retro computers, games, and tech (LazyGameReviews)","3,066","$6,483 per month",$2.11 per month,2468,Jan 2014,NaN
TigerBelly , The Most Beloved Podcast in the Slept Kingdom (TigerBelly),"3,064",,,791,Aug 2018,NaN
Andy & Alex , Music Reviews (AndyAndAlex),"3,060",,,480,Jun 2019,NaN
Loish , digital paintings and sketches (loish),"3,053",,,274,Jan 2020,NaN
Brett Kollmann , the best damn NFL content on the web.,"3,050","$5,582 per month",$1.83 per month,1587,Jun 2016,NaN
Pascal Gilcher , the ReShade Ray Tracing shader (RTGI) and more (mcflypg),"3,049",,,1141,Aug 2017,NaN
Enty Lawyer , Podcast (entylawyer),"3,042",,,766,Sep 2018,NaN
Knitty , a Knitting Magazine (knitty),"3,037",,,1862,Sep 2015,"In 2002, Knitty freaked people out. We published the first issue of our online knitting magazine when there was nothing else like it on the internet. It was completely free, and it didn’t stink. In fact, it was pretty good and it surprised a lot of people. I created Knitty to collect knitting talent from all over the web and publish it in one professional-looking place where it would be properly edited, showcased and get the recognition it deserved from knitters worldwide.

And that’s what we’ve continued to do, for the last 18 years: seek out and publish amazing knitting patterns, encourage and expose more inspiring work from budding knitwear designers, share great patterns from names you already know and love, and showcase great knitting yarns and products. We have helped launch the careers of some of the most talented people in the handknitting industry. As more and more people have become designers thanks to the ease with which they can publish on Ravelry, we continue to bring the brightest and best to your attention, helping them stand out and get the notice they deserve.

Many of the most legendary internet-instigated knitting patterns and techniques found their audience through our pages: the iconic Clapotis, the mind-blowing sock, the inspiring blanket, and the body parts we love to knit – the Womb, the cute and cuddly reproductive organ; and , a functional solution for those who have lost one or both breasts. And so many more...

We are proud of our role in the online knitting world and we want to continue to uphold that mission for the benefit of readers like you, and the designers, patterns and knitting products you’ve yet to see. In order to do that,





. Knitty will still come out every 3 months absolutely free, for as long as we’re able to produce it. But could you pay? Would you contribute a few dollars an Issue to thank the contributors for their work and to make sure it can continue? For all the enjoyment you've gotten from Knitty over the years? To make sure that you don’t miss out on the next cowl, shawl, or designed by a ridiculously talented 15-year-old high school student?

What do you get in return? Scroll down past this message to see the different reward levels. I hope there's one that feels right to you. 

Being able to connect with Knitty readers like I'm going to be able to through Patreon has me super-excited to meet you all, and hear what you’re thinking, working on, dreaming about. Join at the Tangy level and above, and you'll get access to our online forum, the . It's a Patron-only safe space to talk about just about everything.


- we raised the amount we pay our staff and contributors (writers and designers)
- we transformed new Knitty issues into a much more mobile-friendly format
- we reduced all our Ad prices to help small businesses share their wares
- we created the so no small business is left out

And most significantly, this funding has replaced almost all lost advertising revenue, and kept us funded at a functional level.

would really add up. That's just $8 per year. A larger pledge will make an even bigger difference. But if every person who enjoys Knitty puts two dollars or more in our coffee can, that would quickly add up to a lot of dollars over the year. It means a secure future for Knitty and for our readers.

Should our level of funding increase past the current level, we'll be able to hire a designer who will help steer Knitty towards an even more user friendly experience. This has yet to happen...but I am still hopeful the funding will appear when we need it. 

One important thing to know about Patreon (besides how cool it is) is that it's been built with both the artist (that's us) and the Patrons (that's you) in mind. When we release a new Issue, I send out an official New Issue post that says we've made something and released it to our Patrons. You then have to the end of that month to decide if you still want your money to go to Knitty or not. You're not stuck supporting something you don't love. If you leave things be, we'll get your dollars at the beginning of the month following a new release. The surprises are part of the Issue (no extra charge). So you'll only be contributing 4 times per year, no more.

There are other less-Knitty (less friendly, less tasteful, less positive) ways to pay our bills, but this is the one that feels the most right to us. It will change the magazine for the better and allow us to do things we've only dreamed of for years. Knitty was groundbreaking when it launched in September of 2002, completely free. Patreon is similarly groundbreaking and we're excited to be part of this new platform that allows creators and their community to work together to make beautiful things happen.

(If you have about 6 minutes, take a look at what the Knitterati has to say about us.)



More questions?
 
Thank you for your support for the past 18 years, and for your help in ensuring Knitty stays strong and vibrant into the future!"
InCase , lewd (InCaseArt),"3,036",,,2302,Jun 2014,NaN
Dear Hank and John , Dubious Advice (dearhankandjohn),"3,036","$7,942 per month",$2.62 per month,1771,Dec 2015,"Dear Hank and John is a comedy podcast about death in which questions are answered, dubious advice is dispensed, and listeners are subjected to the news from Mars and AFC Wimbledon. Through this Patreon, you can show us via your monthly dollar whether you prefer Mars, AFC Wimbledon, or neither. And if you choose to support us at $5 a month, you'll get access to our short, Patreon-only podcast, This Week in Ryans.



A portion of the money raised goes to support the pod, but given that it isn't very resource-intensive and we've got tons of sponsorship money rolling in from our fake sponsors, most of your Patreon support goes to help fund our educational productions at SciShow, Crash Course, and elsewhere.

The basic question is: If we made you, would you pay for Dear Hank and John? If so, just give us a percentage of whatever you want to pay as a way of thanking us for making you pay. Or not... That is also cool. We understand that not everybody has money to spend, and we would much rather you make sound financial decisions than support our podcast.

Thanks, and DFTBA!"
Lazarus Redmayne , Friendly tutorials on rope bondage (TheDuchy),"3,033",,,1145,Aug 2017,NaN
Flashback Forever , podcasts and videos (FlashbackForever),"3,018","$4,296 per creation",$1.42 per creation,202,Mar 2020,NaN
Coffee + Crumbs , encouraging content for mothers (coffeeandcrumbs),"3,015",,,1432,Nov 2016,NaN
Many A True Nerd , Gaming Videos on YouTube (manyatruenerd),"3,013","$6,889 per month",$2.29 per month,2160,Nov 2014,"Good afternoon, and welcome to Many A True Nerd.

I'm Jon, and for the last five years, I've been working on building this incredible community. In that time, we've killed everything in Fallout 3, completed Mass Effect without guns, finished Hitman without killing, and got through New Vegas and all its DLC without healing. Thanks to that, we've already grown past 400,000 subscribers.

When I started the channel in 2013, it was just a hobby for me, while I was also working a full-time job. But thanks to the channel's fantastic growth, I decided to leave my job in September 2015 to work exclusively on this, meaning we're making a lot more videos these days, and hopefully better ones too.

That's incredibly exciting, but not without difficulty - YouTube's ad revenue is unreliable, and the amount it pays has been steadily declining for years, so I'm hoping that Patreon can help make this sustainable for me, so I can continue doing this full-time through 2019 and beyond, and take the channel to some exciting new places, with more videos, more community playdays, and more livestreams.

In return, every Patron gets access to the monthly Patroncast - a behind-the-scenes look at Many A True Nerd, where you can also ask any questions you'd like - as well as sneak peeks at upcoming games, and, most importatly, an occasional photo of Tabby, the Many A True Cat.

Anyway, feel free to have a look at some of our videos, which are, and always will be, freely available on YouTube, and if you feel like this is something you'd like to support, then thank you.

All the best, Jon"
Opening Arguments , the legal podcast that helps you make sense of the news. (law),"3,010",,,1513,Aug 2016,NaN
