Creator,Theme,Patrons,Earnings,Per patron,Days Running,Launch Date,About
True Crime Obsessed , podcasts of the non-garbage variety (TrueCrimeObsessed),"36,866",,,979,Jan 2018,"HIEEEE!! WE LOVE YOU! WE'RE SO FRICKIN' PSYCHED YOU WANNA JOIN OUR PATREON FAM!

Hello you gorgeous, non-garbage people! This is 🎶Gillian Pensavalle🎶 and 🎶Pa-trick Hinds🎶 here. We absolutely love making this podcast for you and the fact that you love listening to it AND want to support us makes us want to flip tables in the best way and literally throw the hero bell at you because WE ARE OBSESSED WITH YOU.

Okay, so here's the deal! We're going to make this suuuuper easy for you because we love you and no one has time for any. more. bullshit. IN. THEIR. LIVES!

The TCO Patreon feed has evolved into the place to follow along as we take a deep dive into the longer true crime docu-series - like Serial, The Staircase, Making a Murderer, and The Jinx - that we just can’t cover in the regular feed. It’s like a whole other TCO universe, ad-free, and available at the lowest tier for you!

Want to join us at a higher tier? Fabulous! We have more bonuses for you, like ad-free versions of the regular TCO episodes and access to live show meet-and-greets!

Thank you again so, so, SO much for listening and taking this super fun ride with us. WE LOVE YOU!

Love,
Gillian and Patrick

Quick note about : You lovely new patrons will be charged on the day you join, granting you instant access to all of the binge-worthy Patreon back catalog! After that, you’ll be charged at the beginning of each month - simple as that!"
Chapo Trap House , Chapo Trap House Podcast (chapotraphouse),"35,198","$157,521 per month",$4.48 per month,1597,May 2016,by Graeme Shorten Adams ()
Yagami Yato ," Vocal Artistry, ASMR, And Interactive fiction! (YagamiYato)","33,065",,,839,Jun 2018,NaN
DarkCookie , Summertime Saga (summertimesaga),"25,195","$66,379 per month",$2.63 per month,1512,Aug 2016,NaN
Brandon Stanton , Humans of New York (humansofnewyork),"20,868",,,778,Aug 2018,NaN
The Fantasy Footballers , Fantasy Football Podcasts (thefantasyfootballers),"17,457",,,1869,Aug 2015,"A Message from The Fantasy Footballers

Thank you for stopping by our official Patreon page. Supporters of the podcast receive access to our ever-growing fantasy football community, including an EXTRA episode every week! They also get access to #FootClan-only leagues, premium projections & flex rankings, tools, priority fantasy questions, early access to episodes and other special perks as Official #FootClan Members!


Join thousands of other fantasy football players and #FootClan members as well as the guys (Andy, Jason and Mike) as part of our exclusive fantasy football community where we discuss every trade, transaction, start, sit, must-have waiver wire pickup and fantasy football sleeper, bust and breakout.  We're committed to making The Fantasy Footballers podcast the absolute best fantasy football show on the planet - one that records and produces engaging and entertaining content all season long all year long! 

As fathers and husbands, we left our former day jobs to commit ourselves to The Fantasy Footballers and to , the listener, the supporter, the fantasy football junkie -- the #FootClan!  Please help us as we seek to build out an incredible show as a   podcast, a show without a major network or it's corporate backing and resources.   We never take it for granted and work extremely hard to make this show the best it can possibly be.

Please consider with us and supporting the show, all the while unlocking some   Join our community and help us on this journey by becoming an official #FootClan supporter today.  Let's win some fantasy championships together!  "
Flagrant 2 ," Podcast, Video, and more (Flagrant2)","17,023","$83,460 per month",$4.90 per month,736,Oct 2018,NaN
All Gas No Brakes , Interviews (allgasnobrakes),"16,915",,,364,Oct 2019,NaN
TMG , the Tiny Meat Gang Podcast (tinymeatgang),"16,514","$80,150 per month",$4.85 per month,1088,Oct 2017,NaN
Not Another D&D Podcast , Audio Adventures (naddpod),"15,318",,,880,May 2018,NaN
TrueAnon Podcast , ANTI-Pedophile Podcast & Intelligence Exposure stuff etc (TrueAnonPod),"15,208","$63,911 per month",$4.20 per month,439,Jul 2019,NaN
Pet Foolery , Comics (petfoolery),"15,120",,,624,Jan 2019,NaN
The Conscious Kid , Parenting and Education Resources through a Critical Race Lens (theconsciouskid),"15,023",,,371,Oct 2019,"Welcome to our Patreon page! We are so grateful to have you here with us.

Our goal with Patreon is to create a small, intimate community where we can get to know each other better, create space for in-depth, personal discussions, and respond to specific questions and concerns you have as you navigate intersections of race, equity, parenting, and education.

To share a little bit more about ourselves, we are an 501c3 education nonprofit that equips parents and educators with tools they can use to support racial identity development, critical literacy, and equitable practices in their homes and classrooms. We use critical race theory (which is intersectional) to navigate how issues of race impact young children and their identity development. Most of our work takes place off-line and is focused on critical media literacy research, teaching, advocacy, and increasing access to books that center marginalized groups.

Every person on our team is a parent of color. We are all navigating these issues right alongside you and bring our experiential knowledge and insight to the table, along with our educational and professional qualifications. We all hold graduate degrees and our directors include PhD candidates in Education, HBCU Professors, critical race researchers, and practitioners who each bring over a decade of experience to this work. Our work has been featured by Google, Nickelodeon, the Washington Post, Instagram, Forbes, Teaching Tolerance, People Magazine, School Library Journal, Parents, and NPR CodeSwitch. 

It will allow us to:
-Create a precedent that values and compensates educators of color for our time, labor, and experiential knowledge
-Continue our work and presence on social media to share free resources, books, and information on a daily basis
-Support our partnerships and book donations to Title I schools across the country 
-Engage in more original research. In 2019, we published our Research on Diversity in Children’s Literature  on Dr. Seuss. There are many other critical research projects we can’t wait to accomplish with your support
-Dedicate our time and energy to our work, rather than seeking and worrying about the resources needed to fund it

Thank you for joining us and being a part of this beautiful community. We appreciate your presence and can’t wait to connect on a deeper level in this space!

If you would like to support our work with a one-time contribution instead of becoming a monthly patron, you can do so  Any and all support is invaluable to us."
Kurzgesagt – In a Nutshell , Science Animation Videos (Kurzgesagt),"14,980",,,2594,Aug 2013,NaN
Amanda Palmer , with no intermission. (amandapalmer),"14,615",,,2044,Mar 2015,"HOLA COMRADES!

here we are again….! the next frontier of crowdfunding, the future of sustainable art, the final exam in asking & giving, whatever you wanna call it….this is it, we’re doin’ it.

ever since i launched this patreon community over four years ago (!), i’ve been trying to find a succinct way of explaining what it is. this patreon is for people who want to help sustain my ability and freedom to MAKE WHAT I WANT, WHEN I WANT – liberated from commercial interests – by paying me a set amount of money every time i create something.

for an overview of how patreon works in general, they’ve got a great primer HERE to explain how it works. but basically: you give patreon your credit card # (or paypal) and you’re charged $1 (or more, if you choose) at the end every month to support me and my collaborators in our general art-making undertakings. your support also helps me to pay my general costs-of-doing-business (my office, my staff, all of life).

THE VIDEO UP TOP explains a lot about what i’ve been up to here over the last few years, and how wonderful the effects have been.

as of this writing, there's over 14,000 amazing, unique patrons here and i am perpetually in awe and profoundly grateful that it’s working. it’s changed the way i write, produce and release music...it’s just inspired the hell out of me and a lot of people here on this page, and mark my words, we’re just getting started.

if you wanna, go look at this LIST OF THINGS that i’ve released via the patreon over the last few years:


as you can see, there’s over 100 (whaaaa!) things, ranging from , to , to , to , to about weird charity performance art projects that support libraries, to anti-trump , to made using old voice memos i left for myself in the middle of the night so i wouldn’t forget the weird & emotionally revealing shit my weird husband mumbles in his sleep. all of this work has employed HUNDREDS of other musicians, filmmakers, engineers, graphic designers, painters, you name it….we’ve become our own little organic-art-farm ecosystem.

the main thing to keep in mind as you look at this list is that ALMOST NONE OF THIS WORK IS COMMERCIALLY VIABLE! there’s really just no way in today’s marketplace to “make a profit” from a youtube video with just a few thousand views, or a webcast of a beautiful orchestra show, or a weird animation (which are very time-consuming and expensive to produce) unless you’re a *massive* mainstream artist putting up huge paywalls and/or selling your soul to corporate advertisers. i don’t wanna do that, that’s not who i am.

now, a little backstory.
back in 2012, when i broke free of my soul-sucking major label and used kickstarter to sell my record “theatre is evil” (which ), people were still getting the gist of crowdfunding and patronage. nowadays people are really getting it: artists need ongoing, reliable support – akin to a salary in the “real world” – if they’re going to make it and be happy, working artists. the internet and micropayments are making that possible.

patreon is a great platform for organizing this concept, including the huge advantage that patrons on a budget (who can only afford $1 per month) don’t have to worry about getting charged too much, whereas people with a lot to give (i have a few $100 and $1,000 patrons) are also welcome to support, without expecting huge amounts of time-sinking rewards which drain energy from the artist.

i treasure my $1 patrons as much as my $1,000 patrons. it’s like the obama campaign: every goddamn dollar counts. it’s also sort of like NPR (that’s american for “National Public Radio”, for you foreigners): even though you donate, nobody expects you to be glued and tuned into the radio 24/7 just because you made an annual donation. you donated BECAUSE YOU WANT EVERYONE ELSE to be able to enjoy the top-quality (and free) content that NPR provides. this is a community. everybody pitches in what they can, and i try to keep my content as free as possible, so that EVERYBODY, even the people who cannot afford to be part of this patreon, can enjoy my songwriting and my other artistic undertakings.

more good news: i’m also able to employ a TON of other artists, which in these dying days of arts-funding feels really wonderful and satisfying. as far as that goes, you’re trusting me to be a curator and choose where to spread your money around, so it trickles into improving the lives of a ton of other artists, creators and makers.

call me a commun-ist or a social-ist if you want. mostly i’m just an art-ist that thinks that art is for sharing, not for selling.

this patreon is my starting point, my homebase, my workshop where everything happens in transparent realtime. sometimes i take my finished work and haul it onto the art-wagon and traipse it out into the world marketplace (i.e. i work with real labels/distributors/publicists, etc). i’m planning to do this in 2019 with a GIANT NEW ALBUM. but mostly, those moments are few and far between and don’t cover the rent and the costs of being a full-time artist with a full-time office and a full-time team.

the feedback from the patrons already gathered here has been SO HELPFUL. my patrons have gotten to know me and my team INTIMATELY; how we work, how i work, how it ALL works. we all talk a lot. even though my team sometimes stumbles in the dark and makes mistakes, and even though not everybody subscribing to the patreon LOVES every little thing i produce (how could they??) this system is working BEAUTIFULLY. It’s HUMAN. i cherish and ponder feedback. we are figuring this system out as we go along. it’s a constant discussion. it’s a tribe.

i blog A LOT - a few times a week, sometimes more. i talk about everything...my life, the work, my inspirations, my troubles, my process. my blogs get sent out to the patrons automatically by email (if you’ve enabled email notifications), and i ask a lot of questions and i ask for a lot of input and feedback. you’re never expected to answer, but i read every comment, because i care a shit-ton about this community and whether it’s working for everybody.

if you guys know me, you know i LISTEN. we're here to make this work, and we will. not a lot of songwriters are using this platform, but more are joining every day, and this community is kind of a trail-blazer, since we are making up the rules as we go along.

so. whether you’ve been a fan of mine since the days of The Dresden Dolls or whether you’ve just recently found me through my book, (which is about EXACTLY this topic of art and asking) or you’ve stumbled across my songs or videos online, i would love to invite you to join this community and see what we are doing.

and if you’re already one of my patrons...THANK YOU. i love you and you are making me possible.

and now…..

ALLL THE THIIIIIIIIIIINGS!!!
MOAR THINGS FOREVER!!
let's DO THIS SHIT.

love,
AFP

p.s. one more thing: if you're not familiar with my music, i've made a great primer page to acquaint you, it's called ""a walk through amandalanda"" and has streams of my biggest records and best videos:



p.p.s. if you have questions, please submit them on twitter, on facebook, on my blog, or here on the patron stream once you sign up. you can also read a FAQ (frequently asked questions) on my site, HERE: or send us an email at and we’ll get you sorted.if you’d like more information about How Patreon Works or need help with your patreon account you can view a ton of resources on patreon’s support page and contact their support team directly:"
The Mind of Joey Diaz ," Blog posts, videos, and motivation like only Joey can bring it! (JoeyDiaz)","14,328",,,83,Jul 2020,NaN
CGP Grey , Youtube videos (cgpgrey),"13,978","$42,398 per month",$3.03 per month,2278,Jul 2014,NaN
Lilydusk , Adult Romance Comics + NSFW art (lilydusk),"13,889",,,1109,Sep 2017,"♥ IMPORTANT ♥
Dear visitor, please read before pledging!
1. This Patreon page operates on a ""charge-up-front"" basis. This means you will be billed the day you pledge, and on the 1st of the following month.

2. If you pledge at the end of the month and cancel before the month ends, you will lose access to all paid content on the following month.

3. Please go through my FAQS + Commenting Guideline and Refund Policy page for more important information and answers to queries you might have.

4. I am not always able to respond to all PMs, and I apologise in advance if I have missed yours. 
---

Thank you <33



After making a grisly discovery in the countryside, a small town book editor’s life gets entangled with a young Mafia lord and his intimidating bodyguard...even as every step she takes draws her deeper into the dangerous underworld of the city.




On her way to an arranged marriage, a haughty princess is ambushed and held captive by bandits until she is rescued by a tired, hungry and pissed off soldier. All the accidental knight-in-shining-armour wants is to get some sleep after returning from the battlefield - but having a beautiful princess in tow is making it very difficult for him to do so, in more ways than one.






This tier is for you to show some love and support, and you'll have access to exclusive behind-the scenes content, news, and announcements that I do not share anywhere else.



+ . For $5 a month, you’ll have access to exclusive +18 adults only, uncensored, NSFW  (and less frequently, ) content. I create my NSFW content lovingly with the female audience (and all of your other halves <3) in mind, where ROMANCE, LOVE and NAUGHTY, SEXY FUN take centre stage.

For more information on this NSFW tier, please visit .















♥  ♥ ♥"
The Cum Boys , Cum Town Podcast (cumtown),"13,709","$61,868 per month",$4.51 per month,1562,Jun 2016,NaN
MxR Mods , Skyrim and Fallout 4 Mod videos (mmoxreview),"13,550",,,2272,Jul 2014,NaN
Christine McConnell , Instructional Content (ChristineHMcConnell),"13,165",,,448,Jul 2019,NaN
ContraPoints , video essays and short films (contrapoints),"12,530",,,1561,Jun 2016,"Just Who the Hell Do You Think You Are?

I’m a PhD dropout who makes YouTube videos, mostly discussing Internet culture, politics, and LGBT issues. My main political goal is to counterbalance the hatred toward progressive movements that is so common online, though I'm not afraid to criticize ""my own side"" either. Stylistically, I try to appeal to a wide audience and avoid merely preaching to the choir. I try to make the videos I'd want to watch: well-produced, informative, funny, and entertaining.

And What Are You Going To Do with My Money?

Your support enables me to buy costumes, makeup, props, software, and audio/video equipment. It also now enables me to do this as a full-time job, writing, recording, editing and publishing high-quality videos.

Okay, I’m Sold. But What’s in It for Me?

Depending on their reward level, patrons get updates about what I’m working on, access to outtake/behind-the-scenes videos, participation in AMA live streams, and recognition in my video credits.



The traditional goal is one video per month. As my productions have expanded in length/ambition, the actual rate of my video releases is more like once every six weeks."
Last Podcast On The Left , Podcasts (lastpodcastontheleft),"12,373","$66,209 per month",$5.35 per month,2227,Sep 2014,NaN
Second Captains , The World Service Podcasts (secondcaptains),"12,167",,,1334,Feb 2017,NaN
Jeph Jacques , Comics (jephjacques),"11,837",,,2320,May 2014,NaN
Redamz , Monster Girl Island (monstergirlisland),"11,723",,,1787,Nov 2015,NaN
Meshed VR , Adult VR Games and Simulations (meshedvr),"11,004",,,1173,Jul 2017,"Who is MeshedVR?
MeshedVR is a small indie developer that enjoys advancing state-of-the-art technology in the upcoming field of VR. Our 1st project has focused on advancing character simulation, and a natural outlet of that work is a VR sex simulator! Our Patreon will therefore be dedicated to creating adult VR games utilizing the technology that we have developed and to continue to push the cutting-edge of what is possible to bring you the most realistic sex simulator possible. Virt-a-Mate (VaM for short) is our first sex simulator project designed to meet that goal.

IMPORTANT! Requirements for running Virt-A-Mate (VaM)
VaM requires a Windows PC (Windows 10 recommended) with a DirectX11 compatible video card to run. VaM does not run on MacOS, and does not run natively on Oculus Quest. Oculus Quest can work if used with Oculus Link cable and system. VaM was built for VR, but can also run in a desktop mode. VaM has steep PC requirements due to nature of extensive body physics system and simulated hair and clothing systems. Recommended: Intel i7-7XXX series or higher (3.6 Ghz or higher), Nvidia 1080Ti GPU or higher, 16GB RAM or higher. VaM favors high single-thread CPU performance for overall framerate, but does utilize all CPU cores to an extent. In many cases today, this favors Intel CPUs. VaM hair and cloth simulation also tend to run better on Nvidia GPUs at this time due to how they seem to handle computer shaders more efficiently. A goal of the 2.X version of VaM it to be optimized for a broader range of hardware and offer performance scaling features to enable use on lower-end hardware.

Virt-A-Mate is our first project. It is an adults-only virtual reality sex simulator and sandbox. The goal of this project was to make realistic characters using a combination of realistic joint physics, soft body physics, skin-accurate collisions, and advanced rendering techniques. The characters can come alive by capturing and storing motion capture from off-the-shelf VR controllers like the Vive controllers or Oculus Touch controllers. The characters can react to your movements or objects you control in a realistic manner.

Virt-A-Mate in it's current state is meant as a creative tool for making adult content, but plenty of ready-to-use content is available from the community on the official Discord server (you have option to connect to Discord server after backing) or at the upcoming VaM Hub site.

Virt-A-Mate also includes a desktop mode for those without VR and also for making it easier to make some content. A lot of users use desktop mode to create a significant portion of a scene and then use VR mode to experience their creation.


Newer versions of VaM require the use of an updater. This public post will be kept up-to-date with latest information on downloading and installing through the updater:


Release 1.17: 
Release 1.16: 
Release 1.15.1: 
Release 1.15: 
Release 1.14:
Release 1.13: 
Release 1.12: 
Release 1.11:
Release 1.9: 
Release 1.8: 
Release 1.7: 
Release 1.6: 
Release 1.5.5: 
Release 1.5.1:   
Release 1.4:
Release 1.3:
Release 1.2:
Release 1.1:
Release 1.0:





Connect to the official Discord after pledging on your apps page in your profile. The new Hub site is an even better way to connect and share:






Longer term, and with your support, MeshedVR will invest time working on:"
Crime In Sports / Small Town Murder , BONUS CONTENT! Every other week!! (CrimeInSports),"10,872",,,1606,May 2016,"Hello, Crime in Sports, and Small Town Murder Fans! 

Each week - we work tirelessly to bring you 5+ hours of content. We started with Crime in Sports, and because of all of you guys, we have been able to start Small Town Murder. 

We live for this stuff. We've been having a lot of fun doing it for the past 3 years and we enjoy spending time with you at home, on your commutes, during your workouts, or during work hours. 

""How can I help?"" Well...if you can chip in a couple bucks every now and again, we can try to expand the operation MORE! 

** Don't worry!  The show will always be free. **

But we want to grow (and keep the lights on)!  

Obviously, we don't expect, or assume anyone will contribute to this crazy thing we love doing so much, other than just listening to us every week! Any donation we do receive goes toward creating the best and highest quality content possible -- sound equipment for the studio, research tools, editing, traveling for live shows, etc. (and we are working on how to create more bonus content!) 

If you are new to our crew, you may notice that there are not very many bonus episodes on Patreon; and there may be a few weeks where we do not post any bonus content... but that does not mean we are not working hard on stuff behind the scenes! 

In our ideal world, we'd love to be able to meet each and every one of you maniacs. And with your help, we'd like to make that happen.

Thank you for your continued support. We appreciate each and every one of you! 

We know what you're thinking... Shut up and give me murder!! "
Project Helius , Fallen Doll: Operation Lovecraft - An adult game with VR support (ProjectH),"10,771",,,1489,Sep 2016,NaN
The Tim Dillon Show , a podcast (thetimdillonshow),"10,374","$56,209 per month",$5.42 per month,417,Aug 2019,NaN
The Glass Cannon , a Network of Nerdy Entertainment (glasscannon),"10,148","$72,377 per month",$7.13 per month,1315,Mar 2017,NaN
Blind Wave , Videos (blindwave),"10,066",,,1792,Nov 2015,"Thank you for visiting Blind Wave's Patreon Page!

We have been creating content for nearly 5 years. The content includes reactions, reviews, live streams, table top gaming, and more.

Here we offer thanks to our supporters with early access to various content as well as the raw files that have been edited down for our usual YouTube content.

We will always be releasing content on YouTube for everyone, but here you can get a little extra as a thank you for keeping us doing what we do.

In the video above you can find information regarding the tiers we offer and how you can access your support incentives.

If you have any questions, issues, or concerns, you can Message us here on Patreon and we will get back to you as soon as we can.

Thank you for your support! Because of you we can continue to make the content that you enjoy."
