Creator,Theme,Patrons,Earnings,Per patron,Days Running,Launch Date,About
Hello Future Me , educational content on how to write and meta-fiction commentary (hellofutureme),"1,515",,,1260,Apr 2017,"I have always loved writing and studying good storytelling — why certain pieces of fiction work and others... don't. That passion gave rise to the On Writing and On Worldbuilding series, and if you would like to help me keep doing that, then Patreon is the right way to do so, and thank you. <3

I also adore Tolkien, Avatar: The Last Airbender, and countless other fictional worlds, and my niche tends to be taking real world theory and applying it to these worlds: philosophy (in which I have a degree), psychology, politics, and otherwise. If you like what I do, it would mean the world for you to support me for just a couple of dollars per month. It's hard to know what I will earn from month to month, and Patreon gives me something of a reliable income that helps me:

Make videos of higher quality by affording my amazing editor Alex — the more I can pay him, the more time he can take off to help me.
Be less time-sensitive. I can make larger, more elaborate projects that require weeks to research and write.
Stay doing what I love on YouTube as well as pay my mortgage!
I've done videos on how to write soft and hard magic systems, the story of King Arthur and Excalibur, how Amon took bending away, the philosophy of Tolkien, and so many more. What next? Join the Discord and you'll be able to help me.

If you want the , the money goes to the charities we chose as a community to support (A21 and WWF), but Patreon will support me personally. It really does mean the world when you love this stuff as much as I do. I hope you feel entitled to be your nerdy, geeky self here like I do.

Thank you for supporting me <3 Stay nerdy!

Tim."
BRISxLIFE , Videos (BRISxGANG),"1,514",,,945,Mar 2018,NaN
Tom Cartos ," Maps, Assets and more for TTRPGs (tomcartos)","1,511","$3,081 per Map Set",$2.04 per Map Set,446,Jul 2019,"Hello and welcome to my Patreon!

About Me
My name is Tom, I am a digital artist with a background in architecture and design. Now I am bringing these skills into creating tabletop battle maps and assets for games like Dungeons & Dragons, Pathfinder, Call of Cthulhu and more!

Full Back Catalogue
You can find quick links to relevant information, as well as browse my entire back catalogue (including free stuff) on the Notice Board. If there is anything that is not covered there, please feel free to contact me with any questions you might have.

About my Patreon
It is my hope that these maps will go beyond providing a backdrop to your encounters. They will also help tell your story, provide inspiration for detailed world building and give your players that ever so important feeling of verisimilitude and immersion. Each map set covers multiple levels or areas of a building, dungeon, or environment, creating a real sense of exploration and dynamic gameplay.


New map set uploads are weekly (up to 4x per month), so there will always be something new for your upcoming session. Depending on your tier, you will also get additional bonus material throughout the month that is not charged for. You can find out more about specific tier rewards 

When you sign up, you will not only receive all new creations going forwards, but you will also have access to the complete archive. All content beyond that is free bonus material.


I upload free lo-res (72DPI) versions of each map set every week, so you can see if you like my maps before opting to pledge, or just use the free versions for you campaign. If you choose to use the free maps, but would still like to help support me, I have a Ko Fi page 


If you would prefer to buy my map sets or asset packs as a one off payment, rather than pledging on Patreon, I have a Roll20 Marketplace store . All creations have the option to download as well as be used in the application. Maps and asset packs will be uploaded to Roll20 on an 8-10 week delay after being released on Patreon, and Patrons will always receive the artworks at a discounted price.


Many of the questions you might have will probably have been asked before. You can check the to see if it has the answers you seek. If not, feel free to get in touch!"
TerminalMontage , The Something Series and other videos on the INTERNET (sidequests),"1,511",,,2592,Sep 2013,NaN
Blocked Party , Podcasts (blockedparty),"1,510","$7,569 per month",$5.01 per month,704,Nov 2018,"As everyone on the elementary school playground knows, getting blocked on social media is pretty much the coolest thing that can happen. And as everyone can probably tell, John Cullen and Stefan Heck were the coolest kids in their elementary schools (gifted for John, private for Stefan).

Every month, a $5 donation will get you access to THREE bonus episodes. And these bonuses aren't just ""hey, here's kinda something like the main show, enjoy."" We've done lots of bonus episode types over the course of our Patreon so far: episodes where Stefan dives into his personal blocks, video episodes where John imitates online fast-food reviews or opens a bunch of Funko Pops, a look at awful Fiverr accounts, trivia games, and our most popular bonus episodes: Word Up!, where we take a look at the worst of the cursed celebrity shout-out website Cameo [dot] com. We aren't gonna waste your time.  We put in a ton of effort to make our bonus episodes unique and different and worth your money, and we usually bring some fantastic guests along for the ride with us.

And we're coming up with new bonus episode types all the time. Maybe we'll do one about video games, or music, or the holidays, or how John truthfully got beat up a lot in elementary school by the non-gifted kids. It's whatever. The point is, you're gonna get lots of great bonus content. And if you're dumb enough to give us $100, you can tell us what to do for an episode. A true honour. 

? Seems weird, since you're donating to a podcast. But if you'd rather read than listen (nerd), we also have a , which will get you one newsletter from Stefan and one newsletter from John each month, , you get ""Guest Letters"" where we have writers, friends of the show, and even some listeners write a newsletter, just for you. You get 5 things to read every month, plus you're helping freelancers get paid. It's a good thing. For $4/month, if you think written content is king, you can just snag those newsletters. For $8, you can get both the bonus episodes AND newsletter content, because we want your bucket of content to remain ever full. Or whatever. Pick a better metaphor if you hated reading that as much as I hated typing it.

Thank you for reading, and thank you for donating. We love you."
Sarper Duman , Helping animals (helpanimals),"1,507","$10,505 per month",$6.97 per month,333,Nov 2019,NaN
Bret Weinstein ," content on evolution, civilization, and intolerance. (bretweinstein)","1,503",,,1214,Jun 2017,"Thank you for seeking me out here. I feel like I’ve been cast into a whirlwind, and that makes it very difficult to know how to bring important material to the public. That said, the chorus of voices asking me to do that, over email and social media, has been completely overwhelming. Thank you.

Because that call has been so clear and nearly universal, I feel compelled, though the dust is far from settled at Evergreen, to move forward on this platform, despite the fact that it’s bound to be a little rough at first. I will be posting videos on YouTube, and writing on Medium.

Here’s what you can expect:

The Evergreen story is the tip of a very large and important iceberg. I am quickly going to move off of the details of Evergreen’s absurd descent into madness, and shift to discussing the larger implications for academic institutions, and the breakdown in discourse across civilization that it mirrors. 

Many are also telling me that you want to hear deep, evolutionary analysis. My wife and I have been hearing from students for 15 years that this material must be brought into public view, because it is transformative. I don’t believe in fate, but I am a huge fan of serendipity. If you want to know why living things, including humans, are structured as they are and behave the way that they do: Stay tuned. The story is a surprising one, and many Evergreen students have found it revolutionizing of their world view.

Here's my on the personal responsibility vortex and you can visit my website here: .

Here we go."
Luxee , adult games (Luxee),"1,500","$5,347 per major game update",$3.56 per major game update,1258,Apr 2017,"It's ya boi, Luxee
I create adult video game entertainment! Currently, I am working on a visual novel game called ""PL"". After which, I plan to make more games if I've piqued some people's interests. 

In the game, you take on the role of a man who had a falling out with his wife Emily.



You two went through a break up
It's been fifteen years since then and you've gone to multiple different rehab programs. Now that you're clean of drugs, You decided to start dating Emily once again. You've been dating her online for many months now and your relationship is blossoming. She's taken a new liking to you and believes you two can restore things to the way they used to be. You live in different states, but it's summer time and you've decided to visit Emily in Ohio. The game begins when you first meet her in a bar.

I know this line has lost it's meaning because of Telltale games, in one way or another. I guarantee, you will not encounter every scene in the game on your first playthrough without some  which I do encourage. The actual gameplay comes down to just making decisions.

You will meet a lot of other characters along the way.




PL has a free demo version, version 0.9.1. You'll have to find the download link through my twitter though because I'm not allowed to publicly link it here. Sorry for the inconvenience. If you're a patron however, you can download the lastest versionfor $1+ v0.99 from here:
PL Walkthrough for 10$+ patrons only:
You can contact me over at my twitter 
Or use my email: contact@luxee.games
I also have a discord channel that is open to everyone 
I usually check all of these daily"
健吾 , 可以一戰亞洲好西集！ (eatgoodsite),"1,498",,,1160,Aug 2017,NaN
DarulArqam Studios , Educational Videos on Lessons From Quran (DarulArqam),"1,497",,,2169,Oct 2014,NaN
katy bellotte , pretty things (katybellotte),"1,497",,,174,Apr 2020,NaN
Greg Garage & Radio Greg , Tutto il mondo dell'informazione secondo GREG. (greggarage_radiogreg),"1,496",,,556,Mar 2019,NaN
Geeked Out Nation , Video Reactions & Reviews (GeekedOutNation),"1,495",,,878,May 2018,"SHOWS I HAVE REACTIONS FOR
Welcome to my Patreon page!

Before We Begin: Before you join understand that this Patreon is Charge Upfront. When you become a Patreon Supporter you will be charged on the day you join. After that you will be charged on the 1st of Every Month. So if you join late in the month understand you will be charged on the 1st of the following month.

Please Contact Me If You Have Any Questions.

What's up Jabronis. My Name is Steven and for the past 4 years I have been making videos on YouTube and I absolutely love it. From Reviews to Podcast to Top 10s and Reactions. My content can range from anything in Geek Culture be it Comics, Movies, TV Shows and even WWE related content.

I want to thank everyone who has stuck with me through the channels often transformations. I have always known what I wanted GeekedOutNation to be but have never been able to make it the dream I have for it. I love to love things in geek culture and have always believed that you should geek out about anything no matter what it is. The channel was meant to be a place where you could feel connected and never judged, a Nation of people who wanted to geek out and have someone they can connect with.

I love making Top 10 videos because it gives you an insight into my thoughts on the topic of the video, the problem is that editing videos is a long process for me. I have to go through what the list will be, narrow down the list from dozens of choices and write paragraphs on each one chosen(3-5 Hr). After that, I have to record the audio(1Hr), create the graphics, look up the information that will go in the graphic, find all the video footage and pictures that I will put in the video, edit it together, render it, upload it and fill out the YouTube information(6-8Hr). This is all because I don’t have the best computer and certain parts of the process take longer than they need too. I have a lot of different ideas for the channel & want it to grow but don’t have the time, manpower and money to do so.

Don’t take this the wrong way, this is not me complaining because I love making videos. It is just that as you have seen consistency has been an issue for me due to the amount of time it takes to do everything. With YouTube not being my full-time job, I have to make time to do it and that leaves me with little hours of sleep and not as much content as I would like for you guys.

Now, this brings us to the main reason as to why I am here on Patreon. I am on Patreon in hopes that I can make video creation my full-time job in the future.Your contribution will help me provide all of you with more content with better quality at a more regular and consistent rate. The dream is to grow the channel to the point where I can move beyond Patreon and still give you guys quality, consistent content.

Supporting Geeked Out Nation means that not only will I continue to deliver free content, but I will also be able to upgrade and expand the channel beyond my dream. So whether you just give $1 or chose a higher tier everything you give will be to support Geeked Out Nation going forward. Anything you are able to give on Patreon, I want you to know and understand that it means the world to me and the future of the channel will truly be in your hands.


I want to make sure that I tell you guys my future plans as of right now with the channel. Below I will list ideas for shows I have had and look to the Patreon supporters which sound the most pleasing.


Mon – Top 10, TV Show Reaction
Tues – TV Show Reaction
Wednesday – Top 10, TV Show Reaction
Thursday – TV Show Reaction
Friday – Top 10, TV Show Reaction
Saturday – Open, TV Show Reaction
Sunday- Open, TV Show Reaction, PPV Review Live


Reasons to Watch
Comic Quick Takes
What to watch instead
What to play instead
Why Critics Hate (Check out reasons critics gave for disliking a film)
Actor Battles ( Talk about which actors have had the better career)
Wrestler Battles ( Which wrestlers have had the better career)
Movie vs (We pit two movies against one another and debate)
Morning Geek Talk
Games – (Over/Under, Name That)
Gaming Channel GeekedOutGaming (Lets Plays Life or Level, Brother vs Brother, Co-op, Time Attack)"
Ben Eater , Videos (beneater),"1,492",,,1685,Feb 2016,NaN
Patrick (H) Willems , Thrilling Entertainment (patrickhwillems),"1,492",,,1842,Sep 2015,NaN
Rude Tales of Magic , the rudest possible D&D actual play podcast (rudetalesofmagic),"1,491","$15,336 per month",$10.29 per month,379,Sep 2019,NaN
Alexander Grace , Educational Videos (alexandergrace),"1,491",,,1443,Oct 2016,"Table Of Contents For All Exclusive Videos: https://www.patreon.com/posts/all-my-patreon-37241320

My name is Alexander Grace and I make educational content to help people understand and enjoy life. I look beneath the surface and explain the psychology of dating, relationships and gender dynamics as well as other topics.

While all of my content is formed out of my own direct experiences, I borrow from Objectivism and Evolutionary Biology and Psychology. I also feature female guests and street interviews with women discussing these topics. 

I use Patreon to post bonus videos. This is exclusive content not available to the general public. If you have a question you would like me to do a video on, please send me a private message via Patreon.

I reject all forms of tribalism, collectivism and co dependence. All of my work is geared towards helping people become healthy and sovereign individuals so that humans can co exist peacefully and for each other's mutual benefit.

Thank you so much for your support. It means so much to me and it helps keep me enthusiastic for making content. I look forward to getting to know you. 

Alexander Grace

btw if you're interested in speaking with me privately, I offer skype consultations at a rate of $100 an hour. To organize a time, contact me via email alexandergraceful@gmail.com and be sure to include your timezone."
CheekyGimp , Adult Games (CheekyGimp),"1,491","$8,729 per month",$5.85 per month,947,Mar 2018,"Latest version: Episode 18
Episode 18 out since 3rd October

Game Links
Episode 1-18: ($10 Patrons only) Ep18
Episode 1-17: (Patrons only) Ep17
Episode 1-16: (Public) Ep16


Episode 1-17 Unofficial Android Link**: ($5+ Patrons only) Ep17 Unofficial Android
**Android is not created / supported by the dev team. The android version is created by a third-party.



Walkthroughs
Episode 1-16 Walkthrough ($10+ patrons): Ep1-16 walkthrough
(All patrons)  









is a first-person POV adult adventure where you control the Male Main Character. 
You are returning to your childhood home to visit your mother's best friend Monica and Monica's two daughter's whom you grew up with. It has been several years since you've seen them, so the game centers around the MC's quest to re-build these old relationships, forge new ones and deal with everything life has to throw at you including the fallout from your deceased Father's will.... In addition to these three ladies, there'll be plenty of other characters in play (friends, foes, neighbors, stalkers and the ""Coffee-Shop Girl"").
There will be some minor / major plot storylines with a primary focus on conversation based choices & action based choices.
Some characters will be easier/harder to ""crack"" and some relationships will be a slow-burn romance (or corruption) while others will be a quick passionate affair (or rejection).
It's up to you to get the required results by figuring out what characters like or don't like and making the right choices to get there.   is being developed using the Renpy gaming engine with Full-HD (1920 x 1080) rendered graphics.

We are creating Adult content (Games / Visual Novels) under the label .
Started off as a solo project, but it is now a four-person team, consisting of:

/ - CheekyGimp
Ace
Phalzyr
-  "
H0rs3 , Animations (h0rs3),"1,488",,,1859,Sep 2015,NaN
Evan and Katelyn , free DIY and Gaming Videos (evanandkatelyn),"1,488",,,1213,Jun 2017,"Hey guys, we're Evan and Katelyn, and our Patreon is a place we share fun bonus content and connect with y'all! We're very involved here with our patron crew and like to think of y'all as our inner circle of internet friends. We go to y'all for video advice, project ideas, and let you know stuff going on behind the scenes that no one else knows about.

In terms of bonus content, we share an ""Aftershow"" for every main channel video (where we talk about behind the scenes stuff), sneak peeks several times a week, and occasional mini vlogs. (Check out details listed under the reward tiers)


Thank you guys so much for the support here! It means a ton to us and helps us turn down sponsorships that aren't a good fit, hire outside help, and most important when things get tough/stressful, knowing we have you guys rooting for us really keeps us chonkin' along. <3 E&K"
ASMR | MASSAGE , videos (massagevids),"1,482",,,161,Apr 2020,NaN
Lay Lo , Art and comics (LayLo),"1,480","$1,861 per month",$1.26 per month,1710,Jan 2016,"Hi! My name is Lay-lo. I am an artist who wants to draw my own comics)
Здравствуйте! Меня зовут Lay-lo, и на этой странице я в основном, представляю свой комикс)

The site is in two languages: English and Russian (comic pages are also presented in two languages)
Сайт ведется на двух языка: английском и русском (страницы комикса так же выкладываются на двух языках)

I hope you enjoy my story!
Надеюсь вам понравится моя история!"
ЭРА ПЕРЕМЕН , video (eraperemen),"1,480",,,485,Jun 2019,"КАРТА РЕСУРСА ""ЭРА ПЕРЕМЕН""    https://youtu.be/9w4H0YtdWVY
ВНИМАНИЕ ПРИ РАБОТЕ С ПЭТРИОН ОТКЛЮЧАЙТЕ АВТОПЕРЕВОДЧИК САЙТА ОН КОВЕРКАЕТ ТЕКСТ ВАШИХ И МОИХ СООБЩЕНИЙ

1.Как платить и регистрироваться: https://www.youtube.com/watch?v=kZ-uKoO2h3U&t=213s
ОТПИСАТЬСЯ ОТ РЕСУРСА МОЖНО В ВАШЕМ ЛИЧНОМ КАБИНТЕ. ЕЖЕМЕСЯЧНОЕ СПИСАНИЕ ПРОИСХОДИТ АВТОМАТИЧЕСКИ ПО 1 ЧИСЛАМ.
https://youtu.be/Lw83wf0ZyLk  как отписаться
2. ИНВЕСТИЦИОННЫЕ ИДЕИ. СДЕЛКИ (ФОРТС, АКЦИИ)  https://www.patreon.com/posts/spekuliativnye-i-35011830 (Портфель инвестора ""и"" Запасной Аэродром "")
3. Моя рабочая МЕТОДИКА НА БИРЖЕ, обучающие материалы. Все, что нужно, - это полезная масса. https: //www.patreon.com/posts/moia-rabochaia-28171 ...
4. РАБОТА И УСЛУГИ ДЛЯ СВОИХ   https: //www.patreon.com/posts/rabota-i-uslugi-2813 ...
5 НОВАЯ ЗЕМЛЯ (контакты в деревнях, эко поселения):    https: //www.patreon.com/posts/novaia-zemlia-v-2807 ...
6. Проект ""ЗАПАСНОЙ АЭРОДРОМ"". Все, что нужно, - это проверить цены на продукты и жилье, итд. В общем боевая разведка). ПОДПИСАВШИЕСЯ ПОЛУЧАЮТ ДОСТУП КО ВСЕМ РЕСУРСАМ КРОМЕ ""Портфель инвестора"" "
Forehead Fables Podcast , Shitposts (ForeheadFables),"1,476","$9,178 per month",$6.22 per month,460,Jul 2019,NaN
Patrick Wardle , Mac Security Tools (objective_see),"1,474",,,1297,Mar 2017,NaN
Rinhee ," NSFW, Hentai animation (rinhee)","1,471",,,1081,Oct 2017,"English---------------------------------

Hello world! 
I'm Rinhee from Pixiv / Twitter

I draw hentai.

That's all that's all I've got to say to explain myself.

If you like my art and want some more, please support me!


All the rewards of the current month will be sent to you via message after you are successfully charged at the beginning of next month. 

Past rewards : https://gumroad.com/hentairinhee


  "
Untap.in , a table-top card game play tester. (untap),"1,471","$6,549 per month",$4.45 per month,1213,Jun 2017,NaN
Hopkin Looking To Curl One... ," daily features, opinion and insight into the world of CPFC (HLTCO)","1,468",,,1322,Feb 2017,NaN
Jesse Cox , trouble and you're invited! (JesseCox),"1,468",,,1436,Oct 2016,"Ever since I left the warm embrace of the YouTube network scene and forged ahead on my own, I've struggled with the idea that things would inevitably get harder. While I'm thrilled to be working on my own and creating my own path, I've also seen that with this comes the danger of copyright strikes, demonetization issues, and other traps of the solo YouTube gamer. That said, rather than worry about a video getting flagged, I would rather create a complete entertainment experience.

There are two major goals of this Patreon:.


 The first donation goal supports animation. Many of you love the Cox n' Crendor animation series. With your help, our animator, Dan, is working full time on a 50-day production schedule. That means ! In addition, it helps pay for Julian to create Coxtoons and opens up the option of working with other animators in the future.


The next donation goal is for a . Editing and rendering takes a long time, and when I'm doing that, I'm not recording videos. As the channel grows and changes our editing team will be working hard creating content like the Gentlemen's Hentai Club, The Gentlemen's Gaming Club, Coxtease, Scary Game Squad, and getting Fan Friday back where it's supposed to be.... on Saturday morning. It's because of this patreon that we got to explore crazier ideas like GHC, so thank you!

We're talking flying in friends to do Co-op (no more waiting for Crendor to visit to record Outlast 2 for instance), hosting more 24 hour event streams at the office, creating live events both here in LA and in cities near you, and my dream series ""Cox n' Crendor show where I take Crendor around to famous old stuff and film it.""



With your help, I know we can make some really entertaining and wild Cox content. 

You have my supreme thanks and gratitude for any support you can offer. - Jesse"
Arnie , Mods for The Sims 4 (thesimsshop),"1,467",,,204,Mar 2020,NaN
The Spanish Football Podcast , Podcasts (tsfp),"1,467",,,1797,Nov 2015,NaN
Kimmikala , R.U. Screwed (ruscrewed),"1,463",,,1810,Oct 2015,NaN
Zaush , Furry Comics and Illustrations (zaush),"1,463",,,1328,Feb 2017,NaN
